0.220665116,0.222407402,0.222233478,0.225002014,0.231541942,0.229410109,6,6.6,"By 2020, protect and restore water-related ecosystems, including mountains, forests, wetlands, rivers, aquifers and lakes","De aquí a 2020, proteger y restablecer los ecosistemas relacionados con el agua, incluidos los bosques, las montañas, los humedales, los ríos, los acuíferos y los lagos	",176723080.5,1,33467277.4,1
0.93085437,0.915570556,0.925055842,0.930303964,0.936740307,0.946625483,7,7.1,"By 2030, ensure universal access to affordable, reliable and modern energy services","De aquí a 2030, garantizar el acceso universal a servicios energéticos asequibles, fiables y modernos	",12840854.55,1,3096986.684,0.807020457
0.716146764,0.59905574,0.678378531,0.576745409,0.368703168,0.463093739,8,8.1,"Sustain per capita economic growth in accordance with national circumstances and, in particular, at least 7 per cent gross domestic product growth per annum in the least developed countries","Mantener el crecimiento económico per cápita de conformidad con las circunstancias nacionales y, en particular, un crecimiento del producto interno bruto de al menos el 7% anual en los países menos adelantados	",128949899.3,1,24423567.2,0.962629803
0.241295164,0.225572862,0.22257838,0.215230697,0.210878281,0.20007582,8,8.1,"Strengthen the capacity of domestic financial institutions to encourage and expand access to banking, insurance and financial services for all","Fortalecer la capacidad de las instituciones financieras nacionales para fomentar y ampliar el acceso a los servicios bancarios, financieros y de seguros para todos	",128949899.3,1,24423567.2,0.428792509
0.587713502,0.418824142,0.335344236,0.353041109,0.406689079,0.408038067,8,8.2,"Achieve higher levels of economic productivity through diversification, technological upgrading and innovation, including through a focus on high-value added and labour-intensive sectors","Lograr niveles más elevados de productividad económica mediante la diversificación, la modernización tecnológica y la innovación, entre otras cosas centrándose en los sectores con gran valor añadido y un uso intensivo de la mano de obra	",128949899.3,1,24423567.2,0.419421142
0.480906096,0.488090221,0.517311739,0.519295402,0.516477332,0.49426403,8,8.3,"Promote development-oriented policies that support productive activities, decent job creation, entrepreneurship, creativity and innovation, and encourage the formalization and growth of micro-, small- and medium-sized enterprises, including through access to financial services","Promover políticas orientadas al desarrollo que apoyen las actividades productivas, la creación de puestos de trabajo decentes, el emprendimiento, la creatividad y la innovación, y fomentar la formalización y el crecimiento de las microempresas y las pequeñas y medianas empresas, incluso mediante el acceso a servicios financieros	",128949899.3,1,24423567.2,0.354115133
0.463461927,0.457472373,0.45045126,0.447152171,0.469599008,0.447820843,8,8.5,"By 2030, achieve full and productive employment and decent work for all women and men, including for young people and persons with disabilities, and equal pay for work of equal value","De aquí a 2030, lograr el empleo pleno y productivo y el trabajo decente para todas las mujeres y los hombres, incluidos los jóvenes y las personas con discapacidad, así como la igualdad de remuneración por trabajo de igual valor	",128949899.3,1,24423567.2,0.362289462
0.562316898,0.540975334,0.529671157,0.525384897,0.503628506,0.505526874,8,8.6,"By 2020, substantially reduce the proportion of youth not in employment, education or training","De aquí a 2020, reducir considerablemente la proporción de jóvenes que no están empleados y no cursan estudios ni reciben capacitación	",128949899.3,1,24423567.2,0.340735427
0,0,0,0,0,0.01639646,8,8.8,"Protect labour rights and promote safe and secure working environments for all workers, including migrant workers, in particular women migrants, and those in precarious employment","Proteger los derechos laborales y promover un entorno de trabajo seguro y sin riesgos para todos los trabajadores, incluidos los trabajadores migrantes, en particular las mujeres migrantes y las personas con empleos precarios	",128949899.3,1,24423567.2,0.445434968
0.180737711,0.158448139,0.130432872,0.122581477,0.142880819,0.156174722,8,8.9,"By 2030, devise and implement policies to promote sustainable tourism that creates jobs and promotes local culture and products","De aquí a 2030, elaborar y poner en práctica políticas encaminadas a promover un turismo sostenible que cree puestos de trabajo y promueva la cultura y los productos locales	",128949899.3,1,24423567.2,0.428792509
0.410707834,0.35629483,0.350750073,0.306423077,0.34290562,0.40216291,9,9.1,"Develop quality, reliable, sustainable and resilient infrastructure, including regional and transborder infrastructure, to support economic development and human well-being, with a focus on affordable and equitable access for all","Desarrollar infraestructuras fiables, sostenibles, resilientes y de calidad, incluidas infraestructuras regionales y transfronterizas, para apoyar el desarrollo económico y el bienestar humano, haciendo especial hincapié en el acceso asequible y equitativo para todos",5337227520,1,858915827.7,0.133210394
0.454742807,0.428438726,0.385857659,0.427037025,0.478652845,0.458717826,9,9.2,"Promote inclusive and sustainable industrialization and, by 2030, significantly raise industry’s share of employment and gross domestic product, in line with national circumstances, and double its share in least developed countries","Promover una industrialización inclusiva y sostenible y, de aquí a 2030, aumentar significativamente la contribución de la industria al empleo y al producto interno bruto, de acuerdo con las circunstancias nacionales, y duplicar esa contribución en los países menos adelantados	",5337227520,1,858915827.7,0.402830659
0.259332172,0.278581308,0.31966369,0.338834599,0.607183287,0.569843688,9,9.3,"Increase the access of small-scale industrial and other enterprises, in particular in developing countries, to financial services, including affordable credit, and their integration into value chains and markets","Aumentar el acceso de las pequeñas industrias y otras empresas, particularmente en los países en desarrollo, a los servicios financieros, incluidos créditos asequibles, y su integración en las cadenas de valor y los mercados",5337227520,1,858915827.7,0.442141638
0.403262734,0.372290263,0.367618018,0.395949511,0.427408128,0.422177719,9,9.5,"Enhance scientific research, upgrade the technological capabilities of industrial sectors in all countries, in particular developing countries, including, by 2030, encouraging innovation and substantially increasing the number of research and development workers per 1 million people and public and private research and development spending","Aumentar la investigación científica y mejorar la capacidad tecnológica de los sectores industriales de todos los países, en particular los países en desarrollo, entre otras cosas fomentando la innovación y aumentando considerablemente, de aquí a 2030, el número de personas que trabajan en investigación y desarrollo por millón de habitantes y los gastos de los sectores público y privado en investigación y desarrollo",5337227520,1,858915827.7,0.565023995
0.493557447,0.335817343,0.391363871,0.310751602,0.202964052,0.144259736,9,9.b,"Support domestic technology development, research and innovation in developing countries, including by ensuring a conducive policy environment for, inter alia, industrial diversification and value addition to commodities","Apoyar el desarrollo de tecnologías, la investigación y la innovación nacionales en los países en desarrollo, incluso garantizando un entorno normativo propicio a la diversificación industrial y la adición de valor a los productos básicos, entre otras cosas	",5337227520,1,858915827.7,0.442141638
0.608455696,0.610161119,0.638166992,0.677541064,0.702866451,0.66057043,9,9.c,Significantly increase access to information and communications technology and strive to provide universal and affordable access to the Internet in least developed countries by 2020,"Aumentar significativamente el acceso a la tecnología de la información y las comunicaciones y esforzarse por proporcionar acceso universal y asequible a Internet en los países menos adelantados de aquí a 2020	",5337227520,1,858915827.7,0.442141638